<?xml version="1.0" encoding="UTF-8"?>

<!DOCTYPE employees SYSTEM "employee.dtd">

<employees>
	<employee gender="male">
		<id>&quot;190030385&quot;</id>
		<name>D.SAI HARSHITH</name>
		<qualification>High School Graduate</qualification>
		<designation>B.Tech Graduate</designation>
	</employee>
	<employee gender="female">
		<id>&quot;190031415&quot;</id>
		<name>R.JAHNAVI</name>
		<qualification>High School Graduate</qualification>
		<designation>B.Tech Graduate</designation>
	</employee>
</employees>